"DESCRIPTION","DURATION IN MS","NAME","PARENT SUITE","START TIME","STATUS","STOP TIME","SUB SUITE","SUITE","TEST CLASS","TEST METHOD"
"Verifierar rubrik och länkar under ""Om oss""","4362","Verify Footer Om Oss","","Mon Jun 30 16:14:53 UTC 2025","passed","Mon Jun 30 16:14:58 UTC 2025","Footer","Test Cases","",""
"","3135","Verify Menu Om JLT Om Verksamheten Registerutdrag","","Mon Jun 30 16:18:17 UTC 2025","passed","Mon Jun 30 16:18:21 UTC 2025","Header And Menu","Test Cases","",""
"","2845","Verify Menu Biljetter Och Priser Kop Biljett Kundservicebutik","","Mon Jun 30 16:17:24 UTC 2025","passed","Mon Jun 30 16:17:26 UTC 2025","Header And Menu","Test Cases","",""
"","2427","Verify Nyheter Carousel With Heading Is Visible","","Mon Jun 30 16:19:56 UTC 2025","passed","Mon Jun 30 16:19:59 UTC 2025","Homepage","Test Cases","",""
"","2474","Verify Menu Biljetter Och Priser","","Mon Jun 30 16:16:39 UTC 2025","passed","Mon Jun 30 16:16:41 UTC 2025","Header And Menu","Test Cases","",""
"","3485","Verify Menu Foretag Fragor Och Svar","","Mon Jun 30 16:19:19 UTC 2025","passed","Mon Jun 30 16:19:22 UTC 2025","Header And Menu","Test Cases","",""
"This test checks whether the JLT homepage Reseplanerare is visible and returns an HTTP status code of 200 (OK).
Steps:
1. Check if Reseplanerare is visible
2. Send a GET request to JLT homepage Reseplanerare.
3. Verify that the received HTTP status code is 200.","2859","Reseplanerare Should Be Visible and Have HTTP Status Code STATUS_OK (200)","","Mon Jun 30 16:13:34 UTC 2025","passed","Mon Jun 30 16:13:36 UTC 2025","External Dependencies","Test Cases","",""
"","2793","Verify Kartor Och Zoner General","","Mon Jun 30 16:20:22 UTC 2025","passed","Mon Jun 30 16:20:25 UTC 2025","Other Pages","Test Cases","",""
"","2458","Verify Big-button-container Pos 3","","Mon Jun 30 16:19:54 UTC 2025","passed","Mon Jun 30 16:19:56 UTC 2025","Homepage","Test Cases","",""
"","2968","Verify Menu Foretag Att Vara Foretagskund Priser","","Mon Jun 30 16:19:02 UTC 2025","passed","Mon Jun 30 16:19:05 UTC 2025","Header And Menu","Test Cases","",""
"","2706","Verify Menu Res Med Oss Kartor Och Zoner","","Mon Jun 30 16:16:20 UTC 2025","passed","Mon Jun 30 16:16:22 UTC 2025","Header And Menu","Test Cases","",""
"","2993","Verify Menu Res Med Oss Kartor Och Zoner Kommersiell Trafik","","Mon Jun 30 16:16:22 UTC 2025","passed","Mon Jun 30 16:16:25 UTC 2025","Header And Menu","Test Cases","",""
"","2701","Verify Menu Om JLT Tillganglighetsredogorelse Appen","","Mon Jun 30 16:18:48 UTC 2025","passed","Mon Jun 30 16:18:51 UTC 2025","Header And Menu","Test Cases","",""
"","2618","Verify Menu Kundservice Forseningsersattning Formular","","Mon Jun 30 16:18:07 UTC 2025","passed","Mon Jun 30 16:18:09 UTC 2025","Header And Menu","Test Cases","",""
"","3266","Verify Header Translate","","Mon Jun 30 16:15:39 UTC 2025","passed","Mon Jun 30 16:15:42 UTC 2025","Header And Menu","Test Cases","",""
"","2664","Verify Menu Oppna Och Stang Meny Button","","Mon Jun 30 16:15:45 UTC 2025","passed","Mon Jun 30 16:15:48 UTC 2025","Header And Menu","Test Cases","",""
"","3131","Verify Header Logga In","","Mon Jun 30 16:15:42 UTC 2025","passed","Mon Jun 30 16:15:45 UTC 2025","Header And Menu","Test Cases","",""
"","2792","Verify Menu Om JLT Tillganglighetsredogorelse","","Mon Jun 30 16:18:40 UTC 2025","passed","Mon Jun 30 16:18:43 UTC 2025","Header And Menu","Test Cases","",""
"This test verifies that the delay compensation form is accessible from the start page,
that the form iframe is visible, and that the form responds with HTTP status 200.
Steps:
1. Navigate to Förseningsersättning form
2. Check iframe is visible
2. Send a GET request to the iframe src
3. Verify that the received HTTP status code is 200.","3390","Forseningsersattning Form Should Be Visible and Have HTTP Status Code STATUS_OK (200)","","Mon Jun 30 16:13:46 UTC 2025","passed","Mon Jun 30 16:13:49 UTC 2025","External Dependencies","Test Cases","",""
"","4506","Verify Menu Foretagsportalen","","Mon Jun 30 16:19:34 UTC 2025","passed","Mon Jun 30 16:19:38 UTC 2025","Header And Menu","Test Cases","",""
"","3054","Verify Menu Biljetter Och Priser Kop Biljett Ombord Pa Buss Och Tag","","Mon Jun 30 16:17:29 UTC 2025","passed","Mon Jun 30 16:17:32 UTC 2025","Header And Menu","Test Cases","",""
"","2527","Verify Menu Om JLT","","Mon Jun 30 16:18:12 UTC 2025","passed","Mon Jun 30 16:18:15 UTC 2025","Header And Menu","Test Cases","",""
"","2801","Verify Menu Om JLT Lediga Tjanster","","Mon Jun 30 16:18:34 UTC 2025","passed","Mon Jun 30 16:18:37 UTC 2025","Header And Menu","Test Cases","",""
"","2882","Verify Menu Biljetter Och Priser Kop Biljett Aterforsaljare","","Mon Jun 30 16:17:27 UTC 2025","passed","Mon Jun 30 16:17:29 UTC 2025","Header And Menu","Test Cases","",""
"This test checks:
1. Performs search
2. Clicks on search result index 0
3. Verifies correct page","4267","Search on ""Ge bort biljett"" and land on the correct page","","Mon Jun 30 16:22:20 UTC 2025","passed","Mon Jun 30 16:22:25 UTC 2025","Search","Test Cases","",""
"","2666","Verify Menu Om JLT Om Verksamheten Hallbarhet","","Mon Jun 30 16:18:26 UTC 2025","passed","Mon Jun 30 16:18:29 UTC 2025","Header And Menu","Test Cases","",""
"","2901","Verify Menu Res Med Oss","","Mon Jun 30 16:15:48 UTC 2025","passed","Mon Jun 30 16:15:51 UTC 2025","Header And Menu","Test Cases","",""
"","2693","Verify Menu Res Med Oss Serviceresor Fardtjanst Efaktura Och Autogiro","","Mon Jun 30 16:16:14 UTC 2025","passed","Mon Jun 30 16:16:17 UTC 2025","Header And Menu","Test Cases","",""
"","2546","Verify Menu Res Med Oss Tillganglighet Och Ledsagning","","Mon Jun 30 16:16:28 UTC 2025","passed","Mon Jun 30 16:16:31 UTC 2025","Header And Menu","Test Cases","",""
"This test checks whether the JLT Mitt Konto is visible and when clicked, returns an HTTP status code of 200 (OK).
Steps:
1. Check if JLT Mitt Konto is visible
2. Send a GET request to JLT Mitt Konto
3. Verify that the received HTTP status code is 200.","3729","Mitt Konto Should Be Visible and Have HTTP Status Code STATUS_OK (200)","","Mon Jun 30 16:13:37 UTC 2025","passed","Mon Jun 30 16:13:40 UTC 2025","External Dependencies","Test Cases","",""
"","2971","Verify Kartor Och Zoner Zonkarta","","Mon Jun 30 16:22:04 UTC 2025","passed","Mon Jun 30 16:22:07 UTC 2025","Other Pages","Test Cases","",""
"","3063","Verify Menu Kundservice Kontakta Oss Aterkop","","Mon Jun 30 16:17:41 UTC 2025","passed","Mon Jun 30 16:17:44 UTC 2025","Header And Menu","Test Cases","",""
"This test checks whether the JLT homepage returns an HTTP status code of 200 (OK).
Steps:
1. Check if Homepage is visible
2. Send a GET request to the JLT homepage.
3. Verify that the received HTTP status code is 200.","2683","Verify HTTP Status Code Is STATUS_OK (200)","","Mon Jun 30 16:19:39 UTC 2025","passed","Mon Jun 30 16:19:41 UTC 2025","Homepage","Test Cases","",""
"","2983","Verify Nyheter Visa Alla Nyheter Link","","Mon Jun 30 16:20:10 UTC 2025","passed","Mon Jun 30 16:20:13 UTC 2025","Homepage","Test Cases","",""
"","3355","Verify Menu Res Med Oss Serviceresor Fardtjanst","","Mon Jun 30 16:16:08 UTC 2025","passed","Mon Jun 30 16:16:11 UTC 2025","Header And Menu","Test Cases","",""
"","2488","Verify Header Biljetter Och Priser","","Mon Jun 30 16:15:29 UTC 2025","passed","Mon Jun 30 16:15:31 UTC 2025","Header And Menu","Test Cases","",""
"This test checks whether the cookie banner is visible on the start page.
Steps:
1. Click on renew consent
2. Click on switch marketing
3. Click on reject
4. Click on renew consent
5. Click on accept","2899","Verify Cookie Banner","","Mon Jun 30 16:14:14 UTC 2025","passed","Mon Jun 30 16:14:17 UTC 2025","External Dependencies","Test Cases","",""
"","2876","Verify Menu Om JLT Om Verksamheten Sociala Medier","","Mon Jun 30 16:18:21 UTC 2025","passed","Mon Jun 30 16:18:23 UTC 2025","Header And Menu","Test Cases","",""
"","3601","Verify Nyheter Scroll Right And Click On Nyhet Pos 4","","Mon Jun 30 16:20:06 UTC 2025","passed","Mon Jun 30 16:20:10 UTC 2025","Homepage","Test Cases","",""
"","2858","Verify Menu Om JLT Cookies","","Mon Jun 30 16:18:37 UTC 2025","passed","Mon Jun 30 16:18:40 UTC 2025","Header And Menu","Test Cases","",""
"Verifierar att Facebook-ikonen/länken finns och fungerar","3642","Verify Footer Facebook Icon","","Mon Jun 30 16:15:11 UTC 2025","passed","Mon Jun 30 16:15:15 UTC 2025","Footer","Test Cases","",""
"Gå till aktuell sida, kontrollera att formuläret är synligt, och att Friendly Captcha är synligt.
Steps:
1. Navigate to Felanmalan Systemteknik, applikationer och trafikdata form
2. Check iframe is visible
3. Check if Friendly Captcha is visible","2763","Felanmalan Systemteknik, applikationer och trafikdata Form and Captcha Should Be Visible","","Mon Jun 30 16:14:11 UTC 2025","passed","Mon Jun 30 16:14:14 UTC 2025","External Dependencies","Test Cases","",""
"Verifierar rubrik och länkar under ""Resa""","3804","Verify Footer Resa","","Mon Jun 30 16:14:42 UTC 2025","passed","Mon Jun 30 16:14:46 UTC 2025","Footer","Test Cases","",""
"Verifierar att modulen med rubriken ""Vanliga frågor om resande"" finns.","2977","Verify FAQ-module General","","Mon Jun 30 16:22:07 UTC 2025","passed","Mon Jun 30 16:22:10 UTC 2025","Other Pages","Test Cases","",""
"","2966","Verify Menu Foretag","","Mon Jun 30 16:18:51 UTC 2025","passed","Mon Jun 30 16:18:54 UTC 2025","Header And Menu","Test Cases","",""
"Verifierar rubrik och länkar under ""Tjänster"" Mitt Konto","3391","Verify Footer Tjanster Mitt Konto","","Mon Jun 30 16:14:58 UTC 2025","passed","Mon Jun 30 16:15:01 UTC 2025","Footer","Test Cases","",""
"Verifierar att LinkedIn-ikonen/länken finns och fungerar","3628","Verify Footer LinkedIn Icon","","Mon Jun 30 16:15:19 UTC 2025","passed","Mon Jun 30 16:15:23 UTC 2025","Footer","Test Cases","",""
"This test checks whether the JLT homepage title is ""Start - Jönköpings Länstrafik"".
Steps:
1. Check if Homepage is visible
2. Get the title of the homepage
3. Verify that the title is ""Start - Jönköpings Länstrafik"".","2362","Verify Title Is Visible","","Mon Jun 30 16:19:41 UTC 2025","passed","Mon Jun 30 16:19:44 UTC 2025","Homepage","Test Cases","",""
"","3155","Verify Menu Biljetter Och Priser Kop Biljett Appen","","Mon Jun 30 16:17:06 UTC 2025","passed","Mon Jun 30 16:17:09 UTC 2025","Header And Menu","Test Cases","",""
"","2983","Verify Menu Foretag Vara Tjanster","","Mon Jun 30 16:19:05 UTC 2025","passed","Mon Jun 30 16:19:08 UTC 2025","Header And Menu","Test Cases","",""
"","2603","Verify Menu Om JLT Press Media","","Mon Jun 30 16:18:32 UTC 2025","passed","Mon Jun 30 16:18:34 UTC 2025","Header And Menu","Test Cases","",""
"","3036","Verify Menu Kundservice Lamna Synpunkter Allman","","Mon Jun 30 16:18:01 UTC 2025","passed","Mon Jun 30 16:18:04 UTC 2025","Header And Menu","Test Cases","",""
"Verifierar att App Store-ikonen/länken finns och fungerar","3826","Verify Footer App Store Link","","Mon Jun 30 16:15:04 UTC 2025","passed","Mon Jun 30 16:15:08 UTC 2025","Footer","Test Cases","",""
"","2763","Verify Menu Biljetter Och Priser Kop Biljett Appen Ge Bort Din Biljett","","Mon Jun 30 16:17:09 UTC 2025","passed","Mon Jun 30 16:17:12 UTC 2025","Header And Menu","Test Cases","",""
"This test checks whether the JLT Foretagsportalen is visible and when clicked, returns an HTTP status code of 200 (OK).
Steps:
1. Check if JLT Foretagsportalen is visible
2. Send a GET request to JLT Foretagsportalen
3. Verify that the received HTTP status code is 200.","5742","Foretagsportalen Should Be Visible and Have HTTP Status Code STATUS_OK (200)","","Mon Jun 30 16:13:40 UTC 2025","passed","Mon Jun 30 16:13:46 UTC 2025","External Dependencies","Test Cases","",""
"","2662","Verify Menu Biljetter Och Priser Vara Biljetter Flexbiljett","","Mon Jun 30 16:16:53 UTC 2025","passed","Mon Jun 30 16:16:55 UTC 2025","Header And Menu","Test Cases","",""
"","2762","Verify Menu Foretag Vara Tjanster Skicka Biljett","","Mon Jun 30 16:19:11 UTC 2025","passed","Mon Jun 30 16:19:14 UTC 2025","Header And Menu","Test Cases","",""
"","2662","Verify Menu Res Med Oss Serviceresor Nartrafik Huskvarnasnurren","","Mon Jun 30 16:16:05 UTC 2025","passed","Mon Jun 30 16:16:08 UTC 2025","Header And Menu","Test Cases","",""
"","2783","Verify Menu Res Med Oss Tillganglighet Ledsagning Barnvagn","","Mon Jun 30 16:16:33 UTC 2025","passed","Mon Jun 30 16:16:36 UTC 2025","Header And Menu","Test Cases","",""
"","2705","Verify Menu Foretag Att Vara Foretagskund Resekort","","Mon Jun 30 16:18:57 UTC 2025","passed","Mon Jun 30 16:18:59 UTC 2025","Header And Menu","Test Cases","",""
"","2799","Verify Menu Om JLT Tillganglighetsredogorelse JLTse","","Mon Jun 30 16:18:43 UTC 2025","passed","Mon Jun 30 16:18:46 UTC 2025","Header And Menu","Test Cases","",""
"","2962","Verify Menu Res Med Oss Serviceresor Sjukresor Halsoskal","","Mon Jun 30 16:15:57 UTC 2025","passed","Mon Jun 30 16:16:00 UTC 2025","Header And Menu","Test Cases","",""
"","3139","Verify Google Translate","","Mon Jun 30 16:14:17 UTC 2025","passed","Mon Jun 30 16:14:20 UTC 2025","External Dependencies","Test Cases","",""
"","2925","Verify Menu Res Med Oss Serviceresor Nartrafik Oasvangen","","Mon Jun 30 16:16:02 UTC 2025","passed","Mon Jun 30 16:16:05 UTC 2025","Header And Menu","Test Cases","",""
"Verifierar att Instagram-ikonen/länken finns och fungerar","4618","Verify Footer Instagram Icon","","Mon Jun 30 16:15:15 UTC 2025","passed","Mon Jun 30 16:15:19 UTC 2025","Footer","Test Cases","",""
"","2553","Verify Menu Biljetter Och Priser Kop Biljett Mitt Konto","","Mon Jun 30 16:17:21 UTC 2025","passed","Mon Jun 30 16:17:24 UTC 2025","Header And Menu","Test Cases","",""
"","2853","Verify Menu Kundservice Lamna Synpunkter Kundpanel","","Mon Jun 30 16:17:55 UTC 2025","passed","Mon Jun 30 16:17:58 UTC 2025","Header And Menu","Test Cases","",""
"","2651","Verify Menu Foretag Vara Tjanster Personalerbjudande","","Mon Jun 30 16:19:14 UTC 2025","passed","Mon Jun 30 16:19:16 UTC 2025","Header And Menu","Test Cases","",""
"Gå till aktuell sida, kontrollera att formuläret är synligt, och att Friendly Captcha är synligt.
Steps:
1. Navigate to Felanmalan Handenhet form
2. Check iframe is visible
3. Check if Friendly Captcha is visible","2703","Felanmalan Handenhet Form and Captcha Should Be Visible","","Mon Jun 30 16:14:02 UTC 2025","passed","Mon Jun 30 16:14:05 UTC 2025","External Dependencies","Test Cases","",""
"","2534","Verify Menu Res Med Oss Linjer Hallplatser Och Tidtabeller","","Mon Jun 30 16:16:17 UTC 2025","passed","Mon Jun 30 16:16:20 UTC 2025","Header And Menu","Test Cases","",""
"","2843","Verify Menu Kundservice Kontakta Oss Hittat Eller Glomt","","Mon Jun 30 16:17:47 UTC 2025","passed","Mon Jun 30 16:17:50 UTC 2025","Header And Menu","Test Cases","",""
"","2651","Verify Header Lanstrafiken Logo","","Mon Jun 30 16:15:23 UTC 2025","passed","Mon Jun 30 16:15:26 UTC 2025","Header And Menu","Test Cases","",""
"This test verifies that the feedback and complaints form is accessible from the start page,
that the form iframe is visible, and that the form responds with HTTP status 200.
Steps:
1. Navigate to Synpunkter Serviceresor form and check iframe is visible
2. Send a GET request to the iframe src
3. Verify that the received HTTP status code is 200.","3290","Synpunkter Serviceresor Form Should Be Visible and Have HTTP Status Code STATUS_OK (200)","","Mon Jun 30 16:13:53 UTC 2025","passed","Mon Jun 30 16:13:56 UTC 2025","External Dependencies","Test Cases","",""
"","2403","Verify Kundpanel Puff Is Visible","","Mon Jun 30 16:20:18 UTC 2025","passed","Mon Jun 30 16:20:20 UTC 2025","Homepage","Test Cases","",""
"Verifierar rubrik och länkar under ""Kundservice""","3588","Verify Footer Kundservice","","Mon Jun 30 16:14:50 UTC 2025","passed","Mon Jun 30 16:14:53 UTC 2025","Footer","Test Cases","",""
"Gå till aktuell sida, kontrollera att formuläret är synligt, och att Friendly Captcha är synligt.
Steps:
1. Navigate to Felanmalan Biljettautomat form
2. Check iframe is visible
3. Check if Friendly Captcha is visible","2901","Felanmalan Biljettautomat Form and Captcha Should Be Visible","","Mon Jun 30 16:13:59 UTC 2025","passed","Mon Jun 30 16:14:02 UTC 2025","External Dependencies","Test Cases","",""
"This test checks whether the JLT homepage returns an HTTP status code of 200 (OK).
Steps:
1. Check if Homepage is visible
2. Send a GET request to the JLT homepage.
3. Verify that the received HTTP status code is 200.","3561","Homepage HTTP Status Code Should Be STATUS_OK (200)","","Mon Jun 30 16:13:30 UTC 2025","passed","Mon Jun 30 16:13:33 UTC 2025","Check All Urls","Test Cases","",""
"","2536","Verify Header Sök","","Mon Jun 30 16:15:36 UTC 2025","passed","Mon Jun 30 16:15:39 UTC 2025","Header And Menu","Test Cases","",""
"","61707","Verify Kartor Och Zoner Terminalkartor Tåg","","Mon Jun 30 16:21:03 UTC 2025","passed","Mon Jun 30 16:22:04 UTC 2025","Other Pages","Test Cases","",""
"This test checks whether the infab kartor are visible on the start page.
Steps:
1. Check if infab kartor are visible
2. Check if infab kartor are clickable
3. Check if infab kartor are visible
4. Check if infab kartor are clickable
5. Check if infab kartor are visible","5185","Verify Infab Kartor","","Mon Jun 30 16:14:35 UTC 2025","passed","Mon Jun 30 16:14:40 UTC 2025","External Dependencies","Test Cases","",""
"","2721","Verify Menu Biljetter Och Priser Vara Biljetter Skolbiljett","","Mon Jun 30 16:17:01 UTC 2025","passed","Mon Jun 30 16:17:04 UTC 2025","Header And Menu","Test Cases","",""
"","2129","Verify Nyheter Carousel Footer Is Visible","","Mon Jun 30 16:20:01 UTC 2025","passed","Mon Jun 30 16:20:03 UTC 2025","Homepage","Test Cases","",""
"","2567","Verify Menu Foretag Att Vara Foretagskund","","Mon Jun 30 16:18:54 UTC 2025","passed","Mon Jun 30 16:18:57 UTC 2025","Header And Menu","Test Cases","",""
"","2909","Verify Menu Kundservice Kontakta Oss","","Mon Jun 30 16:17:38 UTC 2025","passed","Mon Jun 30 16:17:41 UTC 2025","Header And Menu","Test Cases","",""
"","16914","Verify Kartor Och Zoner Terminalkartor Buss","","Mon Jun 30 16:20:46 UTC 2025","passed","Mon Jun 30 16:21:02 UTC 2025","Other Pages","Test Cases","",""
"","2370","Verify Kundpanel Puff Form Link","","Mon Jun 30 16:20:20 UTC 2025","passed","Mon Jun 30 16:20:22 UTC 2025","Homepage","Test Cases","",""
"","2849","Verify Menu Res Med Oss Serviceresor","","Mon Jun 30 16:15:51 UTC 2025","passed","Mon Jun 30 16:15:54 UTC 2025","Header And Menu","Test Cases","",""
"","3042","Verify Menu Res Med Oss Serviceresor Fardtjanst Ansok Om Aterkommande Resor","","Mon Jun 30 16:16:11 UTC 2025","passed","Mon Jun 30 16:16:14 UTC 2025","Header And Menu","Test Cases","",""
"","2874","Verify Menu Biljetter Och Priser Vara Biljetter Enkelbiljett","","Mon Jun 30 16:16:44 UTC 2025","passed","Mon Jun 30 16:16:47 UTC 2025","Header And Menu","Test Cases","",""
"","2385","Verify Header Foretag","","Mon Jun 30 16:15:34 UTC 2025","passed","Mon Jun 30 16:15:36 UTC 2025","Header And Menu","Test Cases","",""
"","2948","Verify Header Res Med Oss","","Mon Jun 30 16:15:26 UTC 2025","passed","Mon Jun 30 16:15:29 UTC 2025","Header And Menu","Test Cases","",""
"","2639","Verify Menu Om JLT Om Verksamheten","","Mon Jun 30 16:18:15 UTC 2025","passed","Mon Jun 30 16:18:17 UTC 2025","Header And Menu","Test Cases","",""
"","2541","Verify Menu Sok","","Mon Jun 30 16:19:25 UTC 2025","passed","Mon Jun 30 16:19:28 UTC 2025","Header And Menu","Test Cases","",""
"Verifierar rubrik och länkar under ""Biljetter och priser""","3599","Verify Footer Biljetter","","Mon Jun 30 16:14:46 UTC 2025","passed","Mon Jun 30 16:14:50 UTC 2025","Footer","Test Cases","",""
"","2831","Verify Menu Biljetter Och Priser Kop Biljett Aktivera Blippa","","Mon Jun 30 16:17:18 UTC 2025","passed","Mon Jun 30 16:17:21 UTC 2025","Header And Menu","Test Cases","",""
"","2722","Verify Menu Kundservice Lamna Synpunkter","","Mon Jun 30 16:17:52 UTC 2025","passed","Mon Jun 30 16:17:55 UTC 2025","Header And Menu","Test Cases","",""
"","2479","Verify Menu Biljetter Och Priser Kop Biljett","","Mon Jun 30 16:17:04 UTC 2025","passed","Mon Jun 30 16:17:06 UTC 2025","Header And Menu","Test Cases","",""
"","2599","Verify Menu Om JLT Om Verksamheten Framtiden","","Mon Jun 30 16:18:24 UTC 2025","passed","Mon Jun 30 16:18:26 UTC 2025","Header And Menu","Test Cases","",""
"","2717","Verify Menu Foretag Vara Tjanster Tjansteresor","","Mon Jun 30 16:19:08 UTC 2025","passed","Mon Jun 30 16:19:11 UTC 2025","Header And Menu","Test Cases","",""
"","2471","Verify Menu Biljetter Och Priser Vara Biljetter","","Mon Jun 30 16:16:41 UTC 2025","passed","Mon Jun 30 16:16:44 UTC 2025","Header And Menu","Test Cases","",""
"","2597","Verify Menu Biljetter Och Priser Vara Biljetter Periodbiljett","","Mon Jun 30 16:16:55 UTC 2025","passed","Mon Jun 30 16:16:58 UTC 2025","Header And Menu","Test Cases","",""
"","3098","Verify Menu Biljetter Och Priser Kop Biljett Biljettautomater","","Mon Jun 30 16:17:15 UTC 2025","passed","Mon Jun 30 16:17:18 UTC 2025","Header And Menu","Test Cases","",""
"Verifierar rubrik och länkar under ""Tjänster"" Nyheter","2582","Verify Footer Tjanster Nyheter","","Mon Jun 30 16:15:01 UTC 2025","passed","Mon Jun 30 16:15:04 UTC 2025","Footer","Test Cases","",""
"","2977","Verify Menu Kundservice Forseningsersattning Alternativa Fardmedel","","Mon Jun 30 16:18:09 UTC 2025","passed","Mon Jun 30 16:18:12 UTC 2025","Header And Menu","Test Cases","",""
"","2577","Verify Menu Res Med Oss Serviceresor Nartrafik","","Mon Jun 30 16:16:00 UTC 2025","passed","Mon Jun 30 16:16:02 UTC 2025","Header And Menu","Test Cases","",""
"","2878","Verify Menu Om JLT Var Trafik","","Mon Jun 30 16:18:29 UTC 2025","passed","Mon Jun 30 16:18:32 UTC 2025","Header And Menu","Test Cases","",""
"","2737","Verify Menu Kundservice Forseningsersattning","","Mon Jun 30 16:18:04 UTC 2025","passed","Mon Jun 30 16:18:06 UTC 2025","Header And Menu","Test Cases","",""
"","2793","Verify Menu Res Med Oss Tillganglighet Ledsagning Stationer","","Mon Jun 30 16:16:36 UTC 2025","passed","Mon Jun 30 16:16:39 UTC 2025","Header And Menu","Test Cases","",""
"","2504","Verify Menu Trafikforandringar","","Mon Jun 30 16:19:28 UTC 2025","passed","Mon Jun 30 16:19:31 UTC 2025","Header And Menu","Test Cases","",""
"","2397","Verify Big-button-container Pos 2","","Mon Jun 30 16:19:51 UTC 2025","passed","Mon Jun 30 16:19:54 UTC 2025","Homepage","Test Cases","",""
"This test checks:
1. Navigates to search page
2. Performs search
3. Verifies result
4. Verifies pagination
5. Goes back and verifies result again","7238","Go To Searchpage And Search on ""Biljett"", Verify Result And Pagination","","Mon Jun 30 16:22:25 UTC 2025","passed","Mon Jun 30 16:22:32 UTC 2025","Search","Test Cases","",""
"Verifierar att alla röda kontaktblock och telefonnummer visas korrekt","2266","Verify Footer Contact Blocks","","Mon Jun 30 16:14:40 UTC 2025","passed","Mon Jun 30 16:14:42 UTC 2025","Footer","Test Cases","",""
"","2737","Verify Menu Kundservice Kontakta Oss Engelska","","Mon Jun 30 16:17:50 UTC 2025","passed","Mon Jun 30 16:17:52 UTC 2025","Header And Menu","Test Cases","",""
"","2952","Verify Menu Biljetter Och Priser Kop Biljett Appen Lana Ut","","Mon Jun 30 16:17:12 UTC 2025","passed","Mon Jun 30 16:17:15 UTC 2025","Header And Menu","Test Cases","",""
"","5920","Verify Arabic Translation","","Mon Jun 30 16:14:20 UTC 2025","passed","Mon Jun 30 16:14:26 UTC 2025","External Dependencies","Test Cases","",""
"This test verifies that the feedback and complaints form is accessible from the start page,
that the form iframe is visible, and that the form responds with HTTP status 200.
Steps:
1. Navigate to Synpunkter Allmän form and check iframe is visible
2. Send a GET request to the iframe src
3. Verify that the received HTTP status code is 200.","3540","Synpunkter Allman Form Should Be Visible and Have HTTP Status Code STATUS_OK (200)","","Mon Jun 30 16:13:49 UTC 2025","passed","Mon Jun 30 16:13:53 UTC 2025","External Dependencies","Test Cases","",""
"Gå till aktuell sida, kontrollera att formuläret är synligt, och att Friendly Captcha är synligt.
Steps:
1. Navigate to Synpunkter Kundpanel form
2. Check iframe is visible
3. Check if Friendly Captcha is visible","2968","Synpunkter Kundpanel Form and Captcha Should Be Visible","","Mon Jun 30 16:13:56 UTC 2025","passed","Mon Jun 30 16:13:59 UTC 2025","External Dependencies","Test Cases","",""
"","2987","Verify Menu Res Med Oss Serviceresor Sjukresor","","Mon Jun 30 16:15:54 UTC 2025","passed","Mon Jun 30 16:15:57 UTC 2025","Header And Menu","Test Cases","",""
"","2689","Verify Menu Kundservice Lamna Synpunkter Serviceresor","","Mon Jun 30 16:17:58 UTC 2025","passed","Mon Jun 30 16:18:01 UTC 2025","Header And Menu","Test Cases","",""
"","8768","Verify France Translation and Back to English","","Mon Jun 30 16:14:26 UTC 2025","passed","Mon Jun 30 16:14:35 UTC 2025","External Dependencies","Test Cases","",""
"","2559","Verify Menu Foretag Logga In Ansok","","Mon Jun 30 16:19:16 UTC 2025","passed","Mon Jun 30 16:19:19 UTC 2025","Header And Menu","Test Cases","",""
"","2466","Verify Biljettvaljaren Puff Is Visible","","Mon Jun 30 16:20:13 UTC 2025","passed","Mon Jun 30 16:20:15 UTC 2025","Homepage","Test Cases","",""
"","4988","Verify Kartor Och Zoner Interaktiv Karta","","Mon Jun 30 16:20:25 UTC 2025","passed","Mon Jun 30 16:20:30 UTC 2025","Other Pages","Test Cases","",""
"","3345","Verify Menu Mitt Konto","","Mon Jun 30 16:19:31 UTC 2025","passed","Mon Jun 30 16:19:34 UTC 2025","Header And Menu","Test Cases","",""
"This test checks:
1. Performs search
2. Clicks on search result index 0
3. Verifies correct page","4232","Search on ""Periodbiljetter"" and land on the correct page","","Mon Jun 30 16:22:16 UTC 2025","passed","Mon Jun 30 16:22:20 UTC 2025","Search","Test Cases","",""
